{
  "scenario_id": "vk_call_debug_captcha_required_v1",
  "provider": "vk",
  "legacy_source": {
    "repo_path": "/home/egor/code/vk-turn-proxy",
    "entrypoint": "client/main.go",
    "function": "getVkCreds",
    "stage_count": 4
  },
  "input": {
    "input_family": "invite",
    "invite_url_redacted": "https://vk.com/call/join/<redacted:vk-join-token>",
    "normalized_join_token_redacted": "<redacted:vk-join-token>"
  },
  "stages": [
    {
      "name": "vk_login_anonym_token",
      "endpoint_id": "vk_login_anonym_token",
      "request": {
        "method": "POST",
        "form_keys": [
          "client_id",
          "token_type",
          "client_secret",
          "version",
          "app_id"
        ],
        "redacted_fields": [
          "client_secret"
        ]
      },
      "response": {
        "status_code": 200,
        "body": {
          "data": {
            "access_token": "<redacted:vk-access-token-1>"
          }
        }
      },
      "outcome": {
        "kind": "continue",
        "extracted": {
          "access_token": "<redacted:vk-access-token-1>"
        }
      }
    },
    {
      "name": "vk_calls_get_anonymous_token",
      "endpoint_id": "vk_calls_get_anonymous_token",
      "request": {
        "method": "POST",
        "form_keys": [
          "vk_join_link",
          "name",
          "access_token"
        ],
        "redacted_fields": [
          "vk_join_link",
          "access_token"
        ]
      },
      "response": {
        "status_code": 200,
        "body": {
          "error": {
            "error_code": 14,
            "error_msg": "Captcha needed",
            "redirect_uri": "<redacted:vk-captcha-redirect-uri>",
            "captcha_img": "<redacted:vk-captcha-image-uri>",
            "captcha_sid": "<redacted:vk-captcha-sid>",
            "remixstlid": "<redacted:vk-remixstlid>"
          }
        }
      },
      "outcome": {
        "kind": "provider_error",
        "error_code": "captcha_required"
      }
    }
  ],
  "expected": {
    "result_kind": "provider_error",
    "provider_error": {
      "stage": "vk_calls_get_anonymous_token",
      "code": "captcha_required"
    }
  }
}
